{
  "schema_version": 1,
  "fps": 24,
  "duration_frames": 25,
  "width": 1280,
  "height": 720,
  "render_mode": "omni_ref",
  "keyframes": [
    {
      "frame": 0,
      "camera": {
        "position": [0.0, 2.0, 5.0],
        "target": [0.0, 1.0, 0.0],
        "fov": 40.0,
        "roll": 0.0,
        "camera_type": "perspective",
        "zoom": 1.0,
        "near": 0.01,
        "far": 1000.0
      },
      "interpolation": "bezier",
      "tangents": {
        "mode": "free",
        "out_x": 0.4,
        "out_y": 2.5,
        "in_x": -0.4,
        "in_y": 0.0
      }
    },
    {
      "frame": 24,
      "camera": {
        "position": [5.0, 4.0, 2.0],
        "target": [0.0, 1.0, 0.0],
        "fov": 30.0,
        "roll": 20.0,
        "camera_type": "perspective",
        "zoom": 1.0,
        "near": 0.01,
        "far": 1000.0
      },
      "interpolation": "bezier",
      "tangents": {
        "mode": "free",
        "out_x": 0.33,
        "out_y": 0.0,
        "in_x": -0.5,
        "in_y": -1.5
      }
    }
  ],
  "objects": [],
  "metadata": {}
}
